{
  "目标": [
    "复核观察期间内整体技术人力成本与折算人头的水平与变化幅度。",
    "说明营收业务（含共享平台）口径的成本、折算人头与收入的匹配情况。",
    "给出整体、营收业务与全口径三个成本率的水平，并解释差异来源。",
    "列明缺少同口径数据的期次与领域，说明缺口对上述结论的影响。"
  ],
  "观察期间": {
    "观察月份": "2026-09",
    "数据截止": "2026-09-30",
    "期次": [
      "2026-01实际",
      "2026-05H1参考",
      "2026-09实际",
      "年末测算",
      "年末目标"
    ],
    "说明": "观察月份 2026-09，数据截止 2026-09-30；期次锚点 2026-01实际、2026-05H1参考、2026-09实际、年末测算、年末目标，与站点数值序列的键名一致。"
  },
  "口径": {
    "整体技术人力成本": {
      "单位": "万元/月",
      "定义": "技术人力成本为当期计入的技术人力相关成本合计，不含运维与设施。",
      "期间": "按观察期间期次取值：2026-01实际、2026-05H1参考、2026-09实际、年末测算、年末目标；其中 2026-01实际 与 2026-09实际 为已发生实际期次，2026-05H1参考 为 H1 冻结对照基准，年末测算与年末目标为前瞻预算与目标估算，不代表已发生实际。",
      "缺失处理": "该期次没有同口径取数时写 null，界面显示为未提供，不以 0 或推测值替代。（例如 2026-05H1参考 未单独拆分整体成本与人头）。"
    },
    "整体折算人头": {
      "单位": "人（当量）",
      "定义": "折算人头为按投入当量折算的人数，非自然人数；与成本口径同源同范围。",
      "期间": "按观察期间期次取值：2026-01实际、2026-05H1参考、2026-09实际、年末测算、年末目标；其中 2026-01实际 与 2026-09实际 为已发生实际期次，2026-05H1参考 为 H1 冻结对照基准，年末测算与年末目标为前瞻预算与目标估算，不代表已发生实际。",
      "缺失处理": "该期次没有同口径取数时写 null，界面显示为未提供，不以 0 或推测值替代。（例如 2026-05H1参考 未单独拆分整体成本与人头）。"
    },
    "营收业务（含共享平台）技术人力成本与折算人头": {
      "单位": "成本：万元/月；折算人头：人（当量）",
      "定义": "只统计营收业务（含共享平台）口径的技术人力成本与折算人头，与整体口径同定义、不同范围。",
      "期间": "按观察期间期次取值：2026-01实际、2026-05H1参考、2026-09实际、年末测算、年末目标；其中 2026-01实际 与 2026-09实际 为已发生实际期次，2026-05H1参考 为 H1 冻结对照基准，年末测算与年末目标为前瞻预算与目标估算，不代表已发生实际。",
      "缺失处理": "营收业务口径缺任一分项时该分项写 null，不用整体口径回填。"
    },
    "收入与成本率": {
      "单位": "收入：万美元/月；成本率：百分比（按原文显示，如 约2%）",
      "定义": "收入为营收业务口径月度收入；成本率 = 技术人力成本 ÷ 同期收入，成本与收入折算为同一币种后计算；全口径技术成本率额外包含运维与设施成本。",
      "期间": "按观察期间期次取值：2026-01实际、2026-05H1参考、2026-09实际、年末测算、年末目标；其中 2026-01实际 与 2026-09实际 为已发生实际期次，2026-05H1参考 为 H1 冻结对照基准，年末测算与年末目标为前瞻预算与目标估算，不代表已发生实际。",
      "缺失处理": "收入或成本缺同口径值时成本率写 null，不用其他期次或其他口径替代。"
    }
  },
  "必答问题": [
    "观察期间内整体技术人力成本是多少？相对期初实际增减多少（金额与百分比）？",
    "整体折算人头的变化与整体技术人力成本的变化是否同向？折算人头口径是否与成本口径一致？",
    "营收业务（含共享平台）的技术人力成本与折算人头分别是多少？占整体口径的比例是多少？",
    "观察期间的收入是多少（万美元/月）？整体技术人力成本率与营收业务技术人力成本率各是多少？",
    "全口径技术成本率（含运维与设施）在哪些期次有同口径值？缺同口径值的期次如何呈现？",
    "哪些结论只能由聚合口径支撑，哪些领域因缺少证据而无法回答？"
  ],
  "数据需求": [
    {
      "字段路径": "月度成本/技术人力成本",
      "单位": "万元/月",
      "口径": "计入技术人力的成本合计，不含运维与设施；需可按期次与业务口径拆分。",
      "对应指标": "整体技术人力成本"
    },
    {
      "字段路径": "月度人力/折算人头",
      "单位": "人（当量）",
      "口径": "按投入当量折算的人数，非自然人数；与成本口径同源同范围。",
      "对应指标": "整体折算人头"
    },
    {
      "字段路径": "月度成本/营收业务技术人力成本",
      "单位": "万元/月",
      "口径": "只含营收业务（含共享平台）的技术人力成本，与整体口径同定义、不同范围。",
      "对应指标": "营收业务（含共享平台）技术人力成本与折算人头"
    },
    {
      "字段路径": "月度人力/营收业务折算人头",
      "单位": "人（当量）",
      "口径": "营收业务（含共享平台）口径的折算人头，范围与上一条一致。",
      "对应指标": "营收业务（含共享平台）技术人力成本与折算人头"
    },
    {
      "字段路径": "月度收入/营收业务收入",
      "单位": "万美元/月",
      "口径": "营收业务口径月度收入；成本率按同期收入折算为同一币种后计算。",
      "对应指标": "收入与成本率"
    },
    {
      "字段路径": "月度成本/运维与设施成本",
      "单位": "万元/月",
      "口径": "运维与设施成本，用于全口径技术成本率；缺失时该口径留空，不用整体成本代替。",
      "对应指标": "收入与成本率"
    }
  ],
  "禁止事项": [
    "不得写入真实组织数据：任务书只写口径、问题与字段映射，真实数字与明细只留在仓库外的工作目录。",
    "不作个人/薪酬/编制判断：只输出聚合口径，不含个人级字段、薪酬明细与编制明细。",
    "不得编造数字：没有取数支撑的值一律写 null，并在 risks/recommendations 的“缺失证据”里写明缺口。",
    "不得改动指标标题与顺序：metrics 的四个标题与顺序与站点期望一致，改动会被页面判为结构错误。",
    "不得把推断写成事实：洞察按“事实/推断/边界”标注，推断必须写明依据与核实方式。",
    "不得把仓库外的真实数据复制进仓库：诊断 JSON 写在仓库外，交接只给路径与校验值。"
  ],
  "schema版本": 4
}
